{
  "$schema": "./../../schemas/domain-scan.schema.json",
  "domain": "contracosta.ca.gov",
  "targetURL": "https://www.contracosta.ca.gov/",
  "www": true,
  "active": true,
  "includeInScan": true,
  "title": "Contra Costa County, CA Official Website | Official Website",
  "lastStatus": 200,
  "responseHeaders": {
    "content-type": "text/html; charset=utf-8",
    "p3p": "CP=\"IDC DSP COR ADM DEVi TAIi PSA PSD IVAi IVDi CONi HIS OUR IND CNT\"",
    "server": "cloudflare",
    "x-content-type-options": "nosniff",
    "x-frame-options": "SAMEORIGIN"
  },
  "cloudflare": false,
  "slow": false,
  "hasStatewideAlerts": false,
  "usesStateTemplate": false,
  "hasJQuery": true,
  "googleAnalytics": [
    "G-PC37G0VFEW",
    "GTM-K73C5PS"
  ],
  "socialLinks": [
    "https://twitter.com/CCCounty",
    "https://twitter.com/CCCounty?ref_src=twsrc%5Etfw",
    "https://www.youtube.com/channel/UCMcge3PizlYUVI-CipBafVQ"
  ],
  "linksToCaGov": false,
  "errorMessage": null,
  "notes": null,
  "nocache": false,
  "goodScan": true
}