{
  "$schema": "./../../schemas/domain-scan.schema.json",
  "domain": "billing.technology.ca.gov",
  "targetURL": "https://billing.technology.ca.gov/login.aspx",
  "www": false,
  "active": true,
  "includeInScan": true,
  "title": "Login",
  "lastStatus": 200,
  "responseHeaders": {
    "content-type": "text/html; charset=utf-8",
    "server": "Microsoft-IIS/10.0",
    "x-aspnet-version": "4.0.30319",
    "x-powered-by": "ASP.NET"
  },
  "cloudflare": false,
  "slow": false,
  "hasStatewideAlerts": false,
  "usesStateTemplate": false,
  "hasJQuery": false,
  "googleAnalytics": [
    "UA-3419582-2"
  ],
  "socialLinks": [],
  "linksToCaGov": true,
  "errorMessage": null,
  "notes": null,
  "nocache": false,
  "goodScan": true,
  "metaAuthor": "State of California"
}