{
  "$schema": "./../../schemas/domain-scan.schema.json",
  "domain": "green.ca.gov",
  "targetURL": "https://www.green.ca.gov/",
  "www": true,
  "active": true,
  "includeInScan": true,
  "title": "Green CA Application",
  "lastStatus": 200,
  "responseHeaders": {
    "content-type": "text/html; charset=utf-8",
    "server": "Microsoft-IIS/10.0",
    "x-aspnet-version": "4.0.30319",
    "x-aspnetmvc-version": "5.2",
    "x-powered-by": "ASP.NET"
  },
  "cloudflare": false,
  "slow": false,
  "hasStatewideAlerts": true,
  "usesStateTemplate": true,
  "hasJQuery": true,
  "googleAnalytics": [
    "UA-24087628-30",
    "UA-3419582-2"
  ],
  "socialLinks": [],
  "linksToCaGov": true,
  "errorMessage": null,
  "notes": null,
  "nocache": false,
  "goodScan": true,
  "metaAuthor": "State of California, Green California"
}