{
  "$schema": "./../../schemas/domain-scan.schema.json",
  "domain": "socogis.sonomacounty.ca.gov",
  "targetURL": "https://socogis.sonomacounty.ca.gov/map/services/",
  "www": false,
  "goodScan": false,
  "active": true,
  "includeInScan": true,
  "title": "ArcGIS Server Error",
  "lastStatus": 400,
  "cloudflare": false,
  "slow": false,
  "hasStatewideAlerts": false,
  "usesStateTemplate": false,
  "hasJQuery": false,
  "googleAnalytics": [],
  "socialLinks": [],
  "linksToCaGov": false,
  "errorMessage": "HTTP 400",
  "nocache": false,
  "responseHeaders": {
    "content-type": "text/html; charset=utf-8",
    "x-content-type-options": "nosniff"
  },
  "notes": null
}