{
  "$schema": "./../../schemas/domain-scan.schema.json",
  "domain": "californianature.ca.gov",
  "targetURL": "https://www.californianature.ca.gov/",
  "www": true,
  "active": true,
  "includeInScan": true,
  "title": "30x30 California",
  "lastStatus": 200,
  "responseHeaders": {
    "content-type": "text/html; charset=utf-8",
    "x-content-type-options": "nosniff"
  },
  "cloudflare": false,
  "slow": false,
  "hasStatewideAlerts": false,
  "usesStateTemplate": false,
  "hasJQuery": false,
  "googleAnalytics": [
    "G-Y6CYCFDK0H",
    "UA-59627195-16"
  ],
  "socialLinks": [],
  "linksToCaGov": false,
  "errorMessage": null,
  "notes": null,
  "nocache": false,
  "goodScan": true
}