{
  "$schema": "./../../schemas/domain-scan.schema.json",
  "domain": "wildfirerecovery.caloes.ca.gov",
  "targetURL": "https://www.wildfirerecovery.caloes.ca.gov/",
  "www": true,
  "active": true,
  "includeInScan": true,
  "title": "California Statewide Wildfire Recovery Resources |",
  "lastStatus": 200,
  "metaGenerator": "CAWeb v.1.13.0",
  "responseHeaders": {
    "content-type": "text/html; charset=UTF-8",
    "referrer-policy": "strict-origin-when-cross-origin",
    "x-content-type-options": "nosniff"
  },
  "cloudflare": false,
  "slow": false,
  "hasStatewideAlerts": true,
  "usesStateTemplate": true,
  "hasJQuery": true,
  "googleAnalytics": [
    "G-69TD0KNT0F",
    "GTM-K2WDCGG",
    "UA-3419582-2"
  ],
  "socialLinks": [
    "https://twitter.com/Cal_OES",
    "https://twitter.com/Cal_OES?ref_src=twsrc%5Etfw",
    "https://www.facebook.com/CaliforniaOES",
    "https://www.youtube.com/user/CalEMATV"
  ],
  "linksToCaGov": true,
  "errorMessage": null,
  "notes": null,
  "nocache": false,
  "goodScan": true,
  "metaAuthor": "State of California"
}