{
  "$schema": "./../../schemas/domain-scan.schema.json",
  "domain": "naturopathic.ca.gov",
  "targetURL": "https://www.naturopathic.ca.gov/",
  "www": true,
  "active": true,
  "includeInScan": true,
  "title": "Department of Consumer Affairs - California Board of Naturopathic Medicine",
  "lastStatus": 200,
  "responseHeaders": {
    "accept-ranges": "bytes",
    "content-type": "text/html",
    "referrer-policy": "strict-origin-when-cross-origin",
    "server": "volt-adc",
    "x-content-type-options": "nosniff",
    "x-frame-options": "SAMEORIGIN",
    "x-xss-protection": "1; mode=block"
  },
  "cloudflare": false,
  "slow": false,
  "hasStatewideAlerts": false,
  "usesStateTemplate": true,
  "hasJQuery": true,
  "googleAnalytics": [
    "G-3CN4M8F95X",
    "G-69TD0KNT0F",
    "GTM-M683DJB",
    "GTM-NBQCVZC",
    "UA-3419582-2",
    "UA-64276560-13"
  ],
  "socialLinks": [
    "https://twitter.com/CABoardofNatMed"
  ],
  "linksToCaGov": true,
  "errorMessage": null,
  "notes": null,
  "nocache": false,
  "goodScan": true,
  "metaAuthor": "State of California"
}