{
  "$schema": "./../../schemas/domain-scan.schema.json",
  "domain": "mobile.cdpr.ca.gov",
  "targetURL": "https://mobile.cdpr.ca.gov/",
  "www": false,
  "active": true,
  "includeInScan": true,
  "title": "Department of Pesticide Regulation Mobile Gallery",
  "lastStatus": 200,
  "responseHeaders": {
    "content-type": "text/html",
    "server": "Microsoft-IIS/10.0",
    "x-cdn": "Imperva"
  },
  "cloudflare": false,
  "slow": false,
  "hasStatewideAlerts": false,
  "usesStateTemplate": false,
  "hasJQuery": false,
  "googleAnalytics": [
    "UA-3419582-2",
    "UA-5300495-1"
  ],
  "socialLinks": [],
  "linksToCaGov": true,
  "errorMessage": null,
  "notes": null,
  "nocache": false,
  "goodScan": true,
  "metaAuthor": "California Department of Pesticide Regulation"
}