{
  "$schema": "./../../schemas/domain-scan.schema.json",
  "domain": "crc.ca.gov",
  "targetURL": "https://crc.ca.gov/",
  "www": false,
  "goodScan": true,
  "active": true,
  "includeInScan": true,
  "title": "California Citizens Redistricting Commission | \"Fair Representation - Democracy at Work!\"",
  "lastStatus": 200,
  "cloudflare": false,
  "slow": false,
  "hasStatewideAlerts": false,
  "usesStateTemplate": true,
  "hasJQuery": true,
  "googleAnalytics": [
    "G-69TD0KNT0F",
    "G-Y7T2KCM7P1",
    "UA-3419582-2",
    "UA-3419582-47",
    "UA-44798820-1"
  ],
  "socialLinks": [
    "https://twitter.com/WeDrawTheLines",
    "https://www.facebook.com/WeDrawtheLinesCA",
    "https://www.instagram.com/wedrawthelines/",
    "https://www.youtube.com/@WeDrawtheLinesCA",
    "https://www.youtube.com/watch?v=LZnO6tjJ4Go",
    "https://www.youtube.com/watch?v=bsPzYGxqHA8"
  ],
  "linksToCaGov": true,
  "errorMessage": null,
  "nocache": false,
  "responseHeaders": {
    "alt-svc": "h3=\":443\"; ma=86400",
    "content-type": "text/html; charset=UTF-8",
    "permissions-policy": "private-state-token-redemption=(self \"https://www.google.com\" \"https://www.gstatic.com\" \"https://recaptcha.net\" \"https://challenges.cloudflare.com\" \"https://hcaptcha.com\"), private-state-token-issuance=(self \"https://www.google.com\" \"https://www.gstatic.com\" \"https://recaptcha.net\" \"https://challenges.cloudflare.com\" \"https://hcaptcha.com\")",
    "server": "cloudflare",
    "x-content-type-options": "nosniff",
    "x-powered-by": "WP Engine"
  },
  "notes": null,
  "finalUrl": "https://wedrawthelines.ca.gov/",
  "metaGenerator": "CAWeb v.1.13.4",
  "metaAuthor": "State of California",
  "cosmeticTargetDomain": "wedrawthelines.ca.gov"
}