{
  "$schema": "./../../schemas/domain-scan.schema.json",
  "domain": "ctc.ca.gov",
  "targetURL": "https://www.ctc.ca.gov/",
  "www": true,
  "active": true,
  "includeInScan": true,
  "title": "Commission on Teacher Credentialing |",
  "lastStatus": 200,
  "metaGenerator": "CAWeb v.1.13.4",
  "responseHeaders": {
    "alt-svc": "h3=\":443\"; ma=86400",
    "content-type": "text/html; charset=UTF-8",
    "permissions-policy": "private-state-token-redemption=(self \"https://www.google.com\" \"https://www.gstatic.com\" \"https://recaptcha.net\" \"https://challenges.cloudflare.com\" \"https://hcaptcha.com\"), private-state-token-issuance=(self \"https://www.google.com\" \"https://www.gstatic.com\" \"https://recaptcha.net\" \"https://challenges.cloudflare.com\" \"https://hcaptcha.com\")",
    "server": "cloudflare",
    "x-content-type-options": "nosniff",
    "x-powered-by": "WP Engine",
    "x-tec-api-origin": "https://www.ctc.ca.gov",
    "x-tec-api-root": "https://www.ctc.ca.gov/wp-json/tribe/events/v1/",
    "x-tec-api-version": "v1"
  },
  "cloudflare": false,
  "slow": false,
  "hasStatewideAlerts": true,
  "usesStateTemplate": true,
  "hasJQuery": true,
  "googleAnalytics": [
    "G-69TD0KNT0F",
    "G-T1XQR9G39D",
    "G-Y7T2KCM7P1",
    "UA-3419582-2",
    "UA-3419582-47"
  ],
  "socialLinks": [
    "https://www.facebook.com/CalCTC",
    "https://www.linkedin.com/company/cal-ctc",
    "https://www.youtube.com/user/CalTeacherCommission"
  ],
  "linksToCaGov": true,
  "errorMessage": null,
  "notes": null,
  "nocache": true,
  "goodScan": true,
  "metaAuthor": "State of California",
  "DOMErrors": [
    "Could not parse CSS stylesheet"
  ]
}