{
  "$schema": "./../../schemas/domain-scan.schema.json",
  "domain": "arts.ca.gov",
  "targetURL": "https://arts.ca.gov/",
  "www": false,
  "active": true,
  "includeInScan": true,
  "title": "Home Page - California Arts Council",
  "lastStatus": 200,
  "metaGenerator": "WordPress 7.0.2",
  "responseHeaders": {
    "accept-ranges": "bytes",
    "content-type": "text/html; charset=UTF-8",
    "server": "nginx",
    "x-et-api-origin": "https://arts.ca.gov",
    "x-et-api-root": "https://arts.ca.gov/wp-json/tribe/tickets/v1/",
    "x-et-api-version": "v1",
    "x-tec-api-origin": "https://arts.ca.gov",
    "x-tec-api-root": "https://arts.ca.gov/wp-json/tribe/events/v1/",
    "x-tec-api-version": "v1"
  },
  "cloudflare": false,
  "slow": false,
  "hasStatewideAlerts": false,
  "usesStateTemplate": false,
  "hasJQuery": true,
  "googleAnalytics": [
    "G-YMHBQ8PVF6"
  ],
  "socialLinks": [
    "https://twitter.com/calartscouncil",
    "https://www.facebook.com/californiaartscouncil?ref=ts",
    "https://www.instagram.com/calartscouncil/"
  ],
  "linksToCaGov": false,
  "errorMessage": null,
  "notes": null,
  "nocache": false,
  "goodScan": true
}