{
  "$schema": "./../../schemas/domain-scan.schema.json",
  "domain": "sanramon.ca.gov",
  "targetURL": "https://www.sanramon.ca.gov/",
  "www": true,
  "active": true,
  "includeInScan": true,
  "title": "Home - City of San Ramon",
  "lastStatus": 403,
  "responseHeaders": {
    "accept-ch": "Sec-CH-UA-Bitness, Sec-CH-UA-Arch, Sec-CH-UA-Full-Version, Sec-CH-UA-Mobile, Sec-CH-UA-Model, Sec-CH-UA-Platform-Version, Sec-CH-UA-Full-Version-List, Sec-CH-UA-Platform, Sec-CH-UA, UA-Bitness, UA-Arch, UA-Full-Version, UA-Mobile, UA-Model, UA-Platform-Version, UA-Platform, UA",
    "cf-mitigated": "challenge",
    "content-type": "text/html; charset=UTF-8",
    "critical-ch": "Sec-CH-UA-Bitness, Sec-CH-UA-Arch, Sec-CH-UA-Full-Version, Sec-CH-UA-Mobile, Sec-CH-UA-Model, Sec-CH-UA-Platform-Version, Sec-CH-UA-Full-Version-List, Sec-CH-UA-Platform, Sec-CH-UA, UA-Bitness, UA-Arch, UA-Full-Version, UA-Mobile, UA-Model, UA-Platform-Version, UA-Platform, UA",
    "cross-origin-embedder-policy": "require-corp",
    "cross-origin-opener-policy": "same-origin",
    "cross-origin-resource-policy": "same-origin",
    "origin-agent-cluster": "?1",
    "permissions-policy": "accelerometer=(),browsing-topics=(),camera=(),clipboard-read=(),clipboard-write=(),geolocation=(),gyroscope=(),hid=(),interest-cohort=(),magnetometer=(),microphone=(),payment=(),publickey-credentials-get=(),screen-wake-lock=(),serial=(),sync-xhr=(),usb=(),xr-spatial-tracking=(self)",
    "referrer-policy": "same-origin",
    "server": "cloudflare",
    "x-content-type-options": "nosniff",
    "x-frame-options": "SAMEORIGIN"
  },
  "cloudflare": true,
  "slow": false,
  "hasStatewideAlerts": false,
  "usesStateTemplate": false,
  "hasJQuery": false,
  "googleAnalytics": [
    "G-1770054989",
    "G-1770057361",
    "G-1776375313",
    "G-1776448674",
    "G-1776708024",
    "G-1776717424",
    "G-1776987132"
  ],
  "socialLinks": [],
  "linksToCaGov": false,
  "errorMessage": "Cloudflare challenge detected",
  "notes": "403 since 2026-04-23",
  "nocache": true,
  "goodScan": true
}