{
  "$schema": "./../../schemas/domain-scan.schema.json",
  "domain": "accountability.ca.gov",
  "targetURL": "https://www.accountability.ca.gov/",
  "www": true,
  "goodScan": true,
  "active": true,
  "includeInScan": true,
  "title": "Accountability | accountability.ca.gov",
  "lastStatus": 200,
  "cloudflare": false,
  "slow": false,
  "hasStatewideAlerts": true,
  "usesStateTemplate": false,
  "hasJQuery": false,
  "googleAnalytics": [
    "G-Q187CRVKVF",
    "GTM-NJ6Q4MV"
  ],
  "socialLinks": [],
  "linksToCaGov": true,
  "errorMessage": null,
  "nocache": false,
  "responseHeaders": {
    "accept-ranges": "bytes",
    "content-type": "text/html",
    "x-powered-by": "ASP.NET"
  },
  "notes": null,
  "metaAuthor": "State of California"
}