{
  "$schema": "./../../schemas/domain-scan.schema.json",
  "domain": "broadbandmap.ca.gov",
  "targetURL": "https://www.broadbandmap.ca.gov/",
  "www": true,
  "active": true,
  "includeInScan": true,
  "title": "California Interactive Broadband Map",
  "lastStatus": 200,
  "responseHeaders": {
    "content-type": "text/html; charset=UTF-8",
    "pragma": "no-cache",
    "server": "Microsoft-IIS/10.0",
    "x-powered-by": "ASP.NET"
  },
  "cloudflare": false,
  "slow": false,
  "hasStatewideAlerts": false,
  "usesStateTemplate": false,
  "hasJQuery": false,
  "googleAnalytics": [],
  "socialLinks": [],
  "linksToCaGov": false,
  "errorMessage": null,
  "notes": null,
  "nocache": true,
  "goodScan": true
}