{
  "$schema": "./../../schemas/domain-scan.schema.json",
  "domain": "californiavolunteers.ca.gov",
  "targetURL": "https://www.californiavolunteers.ca.gov/",
  "www": true,
  "active": true,
  "includeInScan": true,
  "title": "California Volunteers | California Volunteers",
  "lastStatus": 200,
  "metaGenerator": "CAWeb v.1.13.4",
  "responseHeaders": {
    "alt-svc": "h3=\":443\"; ma=86400",
    "connection": "keep-alive",
    "content-encoding": "br",
    "content-type": "text/html; charset=UTF-8",
    "permissions-policy": "private-state-token-redemption=(self \"https://www.google.com\" \"https://www.gstatic.com\" \"https://recaptcha.net\" \"https://challenges.cloudflare.com\" \"https://hcaptcha.com\"), private-state-token-issuance=(self \"https://www.google.com\" \"https://www.gstatic.com\" \"https://recaptcha.net\" \"https://challenges.cloudflare.com\" \"https://hcaptcha.com\")",
    "server": "cloudflare",
    "x-content-type-options": "nosniff",
    "x-powered-by": "WP Engine"
  },
  "cloudflare": false,
  "slow": false,
  "hasStatewideAlerts": false,
  "usesStateTemplate": true,
  "hasJQuery": true,
  "googleAnalytics": [
    "G-69TD0KNT0F",
    "G-T935JFYNE2",
    "G-Y7T2KCM7P1",
    "GTM-P2BGJP8",
    "UA-23110710-36",
    "UA-3419582-2",
    "UA-3419582-47"
  ],
  "socialLinks": [
    "https://www.facebook.com/CaliforniaVolunteers/",
    "https://www.instagram.com/californiavolunteers",
    "https://www.linkedin.com/company/californiavolunteers/",
    "https://www.tiktok.com/@californiavolunteers",
    "https://www.youtube.com/user/CaliforniaVolunteers/"
  ],
  "linksToCaGov": true,
  "errorMessage": null,
  "notes": null,
  "nocache": false,
  "goodScan": true,
  "metaAuthor": "State of California"
}