{
  "$schema": "./../../schemas/domain-scan.schema.json",
  "domain": "careereducation.gov.ca.gov",
  "targetURL": "https://careereducation.gov.ca.gov/",
  "www": false,
  "active": true,
  "includeInScan": true,
  "title": "California Governor's Council for Career Education | Governor's Council for Career Education",
  "lastStatus": 200,
  "metaGenerator": "CAWeb v.1.13.4",
  "responseHeaders": {
    "alt-svc": "h3=\":443\"; ma=86400",
    "connection": "keep-alive",
    "content-encoding": "br",
    "content-type": "text/html; charset=UTF-8",
    "permissions-policy": "private-state-token-redemption=(self \"https://www.google.com\" \"https://www.gstatic.com\" \"https://recaptcha.net\" \"https://challenges.cloudflare.com\" \"https://hcaptcha.com\"), private-state-token-issuance=(self \"https://www.google.com\" \"https://www.gstatic.com\" \"https://recaptcha.net\" \"https://challenges.cloudflare.com\" \"https://hcaptcha.com\")",
    "server": "cloudflare",
    "x-content-type-options": "nosniff",
    "x-powered-by": "WP Engine"
  },
  "cloudflare": false,
  "slow": false,
  "hasStatewideAlerts": false,
  "usesStateTemplate": true,
  "hasJQuery": true,
  "googleAnalytics": [
    "G-69TD0KNT0F",
    "G-Q122BB7YXT",
    "G-Y7T2KCM7P1",
    "UA-3419582-2",
    "UA-3419582-47"
  ],
  "socialLinks": [
    "https://twitter.com/CAPostsecForAll"
  ],
  "linksToCaGov": true,
  "errorMessage": null,
  "notes": null,
  "nocache": true,
  "goodScan": true,
  "metaAuthor": "State of California"
}