{
  "$schema": "./../../schemas/domain-scan.schema.json",
  "domain": "gis.cnra.ca.gov",
  "targetURL": "https://gis.cnra.ca.gov/arcgis/rest/services/",
  "www": false,
  "goodScan": true,
  "active": true,
  "includeInScan": true,
  "title": "Folder: /",
  "lastStatus": 200,
  "cloudflare": false,
  "slow": false,
  "hasStatewideAlerts": false,
  "usesStateTemplate": false,
  "hasJQuery": false,
  "googleAnalytics": [],
  "socialLinks": [],
  "linksToCaGov": false,
  "errorMessage": null,
  "nocache": true,
  "responseHeaders": {
    "content-type": "text/html;charset=utf-8",
    "server": "Microsoft-IIS/10.0, ",
    "x-aspnet-version": "4.0.30319",
    "x-content-type-options": "nosniff",
    "x-frame-options": "SAMEORIGIN",
    "x-powered-by": "ASP.NET",
    "x-xss-protection": "1; mode=block"
  },
  "notes": null
}